### ISSUE TITLE
Synapse not functional with TheHive4

### ISSUE THREAD

**Issue by marpoe** [TheHive-Project/Synapse#54]
The String(query_string) https://thehive-project.github.io/TheHive4py/reference/query/#thehive4py.query.StartsWith) is not supported in TheHive4, but used in 

"query['_string'] = 'description:"{}"'.format(string)" in "TheHiveConnector.py" 

Fix-Recommendation:
Delete: "query['_string'] = 'description:"{}"'.format(string)
and add e.g.: query = ContainsString('description', format(string))

As well, the hard coded user "synapse" has to be changed. In TheHive 4 the users needs to be created in  e-mail format, e.g. synapse@test.com --> for this change the users to your created synapse-user in 

1) TheHiveConnector --> def craftCommTask(self): --> owner ='<-thehive4-user.'
2) EWS2Case --> connectEWS -->  assignee = '-thehive4-user.'

Related to TheHive4 and Synapse

**Comment by mmogilko** [comment]
Hello! I'm not sure if I need create a new issue for my similar problem.

Having been made all suggestions above, ifI call an action to an alert or case webhook is triggered, but with {"action":"None","success":true}. However, {"action":"closeOffense","success":true} is expected (works fine in TH3.4).

```
2021-01-27 12:48:18,618 [INFO] from org.thp.scalligraph.AccessLogFilter in application-akka.actor.default-dispatcher-21 [00000029|] POST /api/alert/~8376/markAsRead took 1235ms and returned 200 5843 bytes
2021-01-27 12:48:18,618 [DEBUG] from org.thp.thehive.services.notification.NotificationActor in application-akka.actor.default-dispatcher-17 [|] Receive AuditStreamMessage(~81924328)
2021-01-27 12:48:18,720 [DEBUG] from org.thp.thehive.services.notification.NotificationActor in application-akka.actor.default-dispatcher-17 [|06cc8946] Notification is related to Audit(d4ebb91a2a19625c:-77eefbd6:177436bf671:-8000:41,update,true,Some(~8376),Some(Alert),Some({"read":true})), Some(org.thp.scalligraph.traversal.TraversalOps$TraversalOpsDefs$$anon$3@1ca3e23b), Organisation(Test,Test LLC)
2021-01-27 12:48:18,759 [DEBUG] from org.thp.thehive.services.notification.NotificationActor in application-akka.actor.default-dispatcher-17 [|06cc8946] Notification trigger AnyEvent is applicable for Audit(d4ebb91a2a19625c:-77eefbd6:177436bf671:-8000:41,update,true,Some(~8376),Some(Alert),Some({"read":true}))
2021-01-27 12:48:18,784 [INFO] from org.thp.thehive.services.notification.NotificationActor in application-akka.actor.default-dispatcher-17 [|06cc8946] Execution of notifier webhook for user None
2021-01-27 12:48:18,905 [DEBUG] from org.thp.thehive.services.notification.notifiers.Webhook in application-akka.actor.default-dispatcher-16 [|06cc8946] Request webhook with message {"operation":"update","details":{"read":true},"objectType":"alert","objectId":"~8376","base":true,"startDate":1611744498576,"rootId":"~8376","requestId":"d4ebb91a2a19625c:-77eefbd6:177436bf671:-8000:41","object":{"_id":"~8376","id":"~8376","createdBy":"synapse@local","updatedBy":null,"createdAt":1611678484903,"updatedAt":null,"_type":"alert","type":"internal","source":"QRadar_Offenses","sourceRef":"2851","externalLink":null,"case":null,"title":"Recommended Blocked Process Running\n containing Process Create\n","description":"## Summaryes":[]}}
2021-01-27 12:48:18,942 [INFO] from org.thp.scalligraph.AccessLogFilter in application-akka.actor.default-dispatcher-16 [00000024|]  GET /api/stream/Rz39N2NvYPbPACHV6pds took 16149ms and returned 200 6003 bytes
2021-01-27 12:48:18,978 [INFO] from org.thp.scalligraph.AccessLogFilter in application-akka.actor.default-dispatcher-24 [0000002c|]  POST /api/v1/query?name=alert-count took 18ms and returned 200 1 bytes
2021-01-27 12:48:18,981 [INFO] from org.thp.scalligraph.AccessLogFilter in application-akka.actor.default-dispatcher-15 [0000002d|]  POST /api/v1/query?name=alerts.count took 20ms and returned 200 1 bytes
2021-01-27 12:48:18,985 [INFO] from org.thp.scalligraph.AccessLogFilter in application-akka.actor.default-dispatcher-15 [0000002b|]  POST /api/v1/query?name=alerts took 27ms and returned 200
2021-01-27 12:48:18,987 [INFO] from org.thp.scalligraph.AccessLogFilter in application-akka.actor.default-dispatcher-16 [0000002a|]  POST /api/v1/query?name=unread-alert-count took 30ms and returned 200 1 bytes
```

From tcpdump output of Synapse service:

```
12:48:18.936460 IP localhost.51096 > localhost.5000: Flags [P.], seq 1634697809:1634703705, ack 889866472, win 512, options [nop,nop,TS val 3329896093 ecr 3329896089], length 5896
E..<..@.@.(.............ao.Q5
H......1.....
.z...z..POST /webhook HTTP/1.1
Content-Type: application/json
content-length: 5760
host: 127.0.0.1:5000
accept: */*
user-agent: AHC/2.1

{"operation":"update","details":{"read":true},"objectType":"alert","objectId":"~8376","base":true,"startDate":1611744498576,"rootId":"~8376","requestId":"d4ebb91a2a19625c:-77eefbd6:177436bf671:-8000:41","object":{"_id":"~8376","id":"~8376","createdBy":"synapse@local","updatedBy":null,"createdAt":1611678484903,"updatedAt":null,"_type":"alert","type":"internal","source":"QRadar_Offenses","sourceRef":"2851","externalLink":null,"case":null,"title":"Recommended Blocked Process Running\n containing Process Create\n","description":"## Summary...]}}
12:48:18.942196 IP localhost.5000 > localhost.51096: Flags [P.], seq 1:153, ack 5896, win 512, options [nop,nop,TS val 3329896099 ecr 3329896093], length 152
E.....@.@..i............5
H.ao.Y...........
.z...z..HTTP/1.1 200 OK
Server: gunicorn/19.7.1
Date: Wed, 27 Jan 2021 10:48:18 GMT
Connection: close
Content-Type: application/json
Content-Length: 33


12:48:18.942220 IP localhost.5000 > localhost.51096: Flags [P.], seq 153:186, ack 5896, win 512, options [nop,nop,TS val 3329896099 ecr 3329896093], length 33
E..U..@.@...............5
I.ao.Y.....I.....
.z...z..{"action":"None","success":true}
```

**Comment by blainedw** [comment]
I updated the code to use the ContainsString recommendation above but it doesn't seem to do matches on the conversation ID. Has anyone else seen this?

**Comment by blainedw** [comment]
Here is the snippet of code I changed in TheHiveConnector.py to make it work instead of ContainsString:

        
        query = Like('description', 'conversation_id: \"' + format(string) + '*')
        

I also reordered the output in the description field so that the conversation id comes first and the static message about case creation by synapse is last.
